{
  "schema_version": "1.0",
  "run_id": "bridge-20260724t100000000z-a1b2c3d4e5f6",
  "created_utc": "2026-07-24T10:00:00+00:00",
  "completed_utc": "2026-07-24T10:00:08+00:00",
  "succeeded": true,
  "checks": [
    {
      "id": "hello-capabilities",
      "passed": true,
      "detail": "Authenticated protocol negotiation returned ArenaGS capabilities."
    }
  ]
}
